{"records":{"9f603f31ece116779d785e43b86e7812c2c6bd2e57503c31c39984ed1abcf127:1":{"closed_observation":null,"decision":null,"generation":1,"intent":{"assessment":{"evidence":["snapshot.json for bld_8447164e945247cc94e31c4bf249aafd: repair round 3 (reviewed 84e63ef6, final 27541682, scoped, divergence-hunter) carries anchor 46305cab; deliverable receipts for the other four lenses have reviewed range b30b8754..84e63ef6 with packet f29f4629 at commit 84e63ef6.","status at snapshot r97: 'deliverable-review receipt: <lens> \u2014 1 authored commit(s) unread (3e834da17021)' for security-governance, spec-conformance, technical-integrity and usability, while acaf3454 (covered by the later round anchored at 27541682) is not listed."],"impact":"patch","rationale":"The anchor is chosen mechanically and the coverage rule rejects it mechanically; no operator judgment is involved and the fix is contained to anchor selection.","remedy":"Anchor the first repair round after a refreshed deliverable review at that review's reviewed commit, and cover it with a regression test.","state":"assessed"},"kind":"Fix","references":[{"label":"Pull request 1257 (C4 write authority), where the mis-anchoring was observed","link":"https://github.com/StarshipSuperjam/engine-template/pull/1257"},{"label":"Anchor selection and coverage scoping in the build coordinator","link":"https://github.com/StarshipSuperjam/engine-template/blob/main/.engine/tools/build_coordinator.py"}],"repository":"StarshipSuperjam/engine-template","submission_id":"c4-repair-anchor-after-repacket-2026-09-13","title":"A scoped repair round assessed after a refreshed deliverable review is anchored before that review, so it exempts nothing","what_this_is":"The build coordinator measures each repair round from the previous repair round's final commit (`_classification_anchor`). When a fresh five-lens deliverable review is run in between (a new deliverable packet on a later commit), the next scoped repair round is still anchored at the OLD round's final commit, which predates the refreshed review's tip. The deliverable-coverage rule (`_coverage_result.apply_scope`) only lets a scoped round exempt the lenses it did not name when the round's anchor sits at or after an original deliverable tip (`after_original`), so that round's exemption is silently discarded: the lenses the session deliberately left out are charged the whole fix as unread, and `status` demands their receipts as if no judgment had been made.\n\n- Observed on the C4 write-authority Build (pull request 1257): round 5 was a fresh five-lens deliverable review at 84e63ef6; the round-5 fix (3e834da1) was judged `scoped` with the divergence-hunter lens only, but the round was anchored at 46305cab (round 3's final commit), and the other four lenses were then reported as owing 3e834da1. A later scoped round anchored at 27541682 (after the refreshed tip) exempted its range correctly, which is what isolates the anchor as the cause.\n- The session cannot repair this itself: `none` needs the deliverable scope complete (circular), and a multi-lens scoped round is counted and stops at the escalation budget for a read the coordinator already excused.","whats_next":"Decide where the anchor should move: when the deliverable review has been refreshed since the previous repair round, the next round's anchor should be the refreshed review's reviewed commit (the newest of the previous round's final commit and the deliverable tip), and `after_original` should then admit it. A regression test: a repair round, a deliverable re-packet on a later commit, then a scoped round naming one lens; the other lenses must be exempt from that round's range.\n\n- Until then, a Build in this shape needs either a counted multi-lens re-read (operator guidance at the escalation budget) or an operator decision to accept the coverage gap as disclosed."},"issue":{"id":5441784572,"number":1306,"url":"https://github.com/StarshipSuperjam/engine-template/issues/1306"},"observation":null,"previous":null,"producer":"manual","request":{"body":"<!-- engine-issue-triage:v1 -->\n\n**Release assessment**\n\nExpected release impact: **patch** (provisional).\n\nRemedy: Anchor the first repair round after a refreshed deliverable review at that review&#x27;s reviewed commit, and cover it with a regression test.\n\nReason: The anchor is chosen mechanically and the coverage rule rejects it mechanically; no operator judgment is involved and the fix is contained to anchor selection.\n\nMilestone: resolution-failed \u2014 Configure the repository milestone mapping with triage configure.\n\n<!-- engine-issue-triage-data: {\"assessment\":{\"evidence\":[\"snapshot.json for bld_8447164e945247cc94e31c4bf249aafd: repair round 3 (reviewed 84e63ef6, final 27541682, scoped, divergence-hunter) carries anchor 46305cab; deliverable receipts for the other four lenses have reviewed range b30b8754..84e63ef6 with packet f29f4629 at commit 84e63ef6.\",\"status at snapshot r97: 'deliverable-review receipt: \\u003clens\\u003e \\u2014 1 authored commit(s) unread (3e834da17021)' for security-governance, spec-conformance, technical-integrity and usability, while acaf3454 (covered by the later round anchored at 27541682) is not listed.\"],\"impact\":\"patch\",\"rationale\":\"The anchor is chosen mechanically and the coverage rule rejects it mechanically; no operator judgment is involved and the fix is contained to anchor selection.\",\"remedy\":\"Anchor the first repair round after a refreshed deliverable review at that review's reviewed commit, and cover it with a regression test.\",\"state\":\"assessed\"},\"assignment\":{\"reason\":\"Configure the repository milestone mapping with triage configure.\",\"state\":\"resolution-failed\"},\"disposition\":null,\"evidence\":\"sha256:06c32a21cee80c9ea27275ba226908f48197620aa3c13d40c78ccb46a19e4746\",\"revision\":1,\"schema_version\":\"issue-triage.v1\",\"submission_id\":\"c4-repair-anchor-after-repacket-2026-09-13\",\"superseded\":null,\"updated_at\":\"2026-09-13T18:00:07Z\"} -->\n<!-- /engine-issue-triage -->\n\n*The engine opened this item itself \u2014 you didn't create it.*\n\n**What this is.** The build coordinator measures each repair round from the previous repair round's final commit (`_classification_anchor`). When a fresh five-lens deliverable review is run in between (a new deliverable packet on a later commit), the next scoped repair round is still anchored at the OLD round's final commit, which predates the refreshed review's tip. The deliverable-coverage rule (`_coverage_result.apply_scope`) only lets a scoped round exempt the lenses it did not name when the round's anchor sits at or after an original deliverable tip (`after_original`), so that round's exemption is silently discarded: the lenses the session deliberately left out are charged the whole fix as unread, and `status` demands their receipts as if no judgment had been made.\n\n- Observed on the C4 write-authority Build (pull request 1257): round 5 was a fresh five-lens deliverable review at 84e63ef6; the round-5 fix (3e834da1) was judged `scoped` with the divergence-hunter lens only, but the round was anchored at 46305cab (round 3's final commit), and the other four lenses were then reported as owing 3e834da1. A later scoped round anchored at 27541682 (after the refreshed tip) exempted its range correctly, which is what isolates the anchor as the cause.\n- The session cannot repair this itself: `none` needs the deliverable scope complete (circular), and a multi-lens scoped round is counted and stops at the escalation budget for a read the coordinator already excused.\n\n**What happens next.** Decide where the anchor should move: when the deliverable review has been refreshed since the previous repair round, the next round's anchor should be the refreshed review's reviewed commit (the newest of the previous round's final commit and the deliverable tip), and `after_original` should then admit it. A regression test: a repair round, a deliverable re-packet on a later commit, then a scoped round naming one lens; the other lenses must be exempt from that round's range.\n\n- Until then, a Build in this shape needs either a counted multi-lens re-read (operator guidance at the escalation budget) or an operator decision to accept the coverage gap as disclosed.\n\n**More detail.**\n- [Pull request 1257 (C4 write authority), where the mis-anchoring was observed](https://github.com/StarshipSuperjam/engine-template/pull/1257)\n- [Anchor selection and coverage scoping in the build coordinator](https://github.com/StarshipSuperjam/engine-template/blob/main/.engine/tools/build_coordinator.py)\n\n<!-- engine-kind: Fix -->\n","labels":["engine"],"title":"Fix: A scoped repair round assessed after a refreshed deliverable review is anchored before that review, so it exempts nothing"},"request_digest":"3dfc9933aed0d48184420996179913b89cb77a0c9ec8be9335ef60a252b0b2e4","send_nonce":"b01459559b974543a6d0d6c120806a02","source_key":"c4-repair-anchor-after-repacket-2026-09-13","state":"confirmed","submission_id":"c4-repair-anchor-after-repacket-2026-09-13"}},"repository_id":1246840141,"revision":3,"schema_version":"issue-recovery.v1"}